<!ELEMENT PRODUCT_LIST (PRODUCT+)>
<!ELEMENT PRODUCT (NAME, DESCRIBE, PRICE, QUANTITY, DATE)>
<!ELEMENT NAME (#PCDATA)>
<!ELEMENT DESCRIBE (#PCDATA)>
<!ELEMENT PRICE (#PCDATA)>
<!ELEMENT QUANTITY (#PCDATA)>
<!ELEMENT DATE (#PCDATA)>
